{
  "$schema": "https://raw.githubusercontent.com/EPFL-ENAC/alice-perl-eerl-urbtrees/main/schema/parameters.schema.json",
  "center": { "lat": 48.3246, "lng": 10 },
  "zoom": 4,
  "popupLayerIds": [],
  "selectableItems": [
    {
      "id": "theme",
      "label": "Theme",
      "children": [
        {
          "id": "classic",
          "label": "Classic",
          "selected": false
        },
        {
          "id": "arcgis",
          "label": "ArcGIS",
          "selected": true
        },
        {
          "id": "light",
          "label": "Light",
          "selected": false
        },
        {
          "id": "dark",
          "label": "Dark",
          "selected": false
        }
      ]
    },
    {
      "id": "projects",
      "label": "projects",
      "tab": true,
      "children": []
    }
  ],
  "title": "app_title",
  "subtitle": "app_subtitle"
}
